[
  {
    "id": "BP-SALES-01",
    "name": "Automated Lead Qualification",
    "department": "Sales",
    "description": "Process of researching, enriching, and scoring inbound leads to determine sales readiness before routing to appropriate reps.",
    "typicalTriggers": [
      "New inbound lead from website form",
      "Lead imported from event or webinar",
      "Lead scored above threshold by marketing automation"
    ],
    "steps": [
      {
        "stepOrder": 1,
        "name": "Lead Capture",
        "owner": "Marketing Automation",
        "duration": "Instant",
        "dependsOn": [],
        "description": "Lead enters system via web form, API, or import",
        "aiOpportunity": "Auto-enrich with company data from public sources"
      },
      {
        "stepOrder": 2,
        "name": "Lead Research",
        "owner": "SDR/BDR",
        "duration": "15-30 min",
        "dependsOn": [
          1
        ],
        "description": "Research lead's company, role, fit, and intent signals",
        "aiOpportunity": "AI research agent performs this in 30 seconds"
      },
      {
        "stepOrder": 3,
        "name": "ICP Scoring",
        "owner": "SDR/BDR",
        "duration": "5 min",
        "dependsOn": [
          2
        ],
        "description": "Score lead against ideal customer profile criteria",
        "aiOpportunity": "Automated ICP scoring from enriched data"
      },
      {
        "stepOrder": 4,
        "name": "Lead Routing",
        "owner": "Sales Operations",
        "duration": "5 min",
        "dependsOn": [
          3
        ],
        "description": "Route qualified lead to appropriate AE or territory",
        "aiOpportunity": "Intelligent routing based on fit, availability, relationship"
      },
      {
        "stepOrder": 5,
        "name": "Outreach Preparation",
        "owner": "SDR/BDR",
        "duration": "10 min",
        "dependsOn": [
          4
        ],
        "description": "Draft personalized outreach message based on lead research",
        "aiOpportunity": "AI-generated personalized email with research context"
      }
    ],
    "kpis": [
      {
        "name": "Lead Response Time",
        "description": "Time from lead capture to first contact",
        "typicalBenchmark": "5 min (best), 60 min (average)"
      },
      {
        "name": "Qualification Rate",
        "description": "Percentage of leads that qualify for sales",
        "typicalBenchmark": "20-30%"
      },
      {
        "name": "Lead-to-Opportunity Rate",
        "description": "Percentage of qualified leads that become opportunities",
        "typicalBenchmark": "40-60%"
      }
    ],
    "systems": [
      {
        "name": "Salesforce",
        "category": "CRM",
        "typicalUsage": "Lead tracking and routing"
      },
      {
        "name": "HubSpot",
        "category": "Marketing",
        "typicalUsage": "Lead capture and initial scoring"
      },
      {
        "name": "ZoomInfo",
        "category": "Other",
        "typicalUsage": "Lead enrichment data"
      },
      {
        "name": "Outreach",
        "category": "Other",
        "typicalUsage": "Sequences and engagement tracking"
      }
    ],
    "complianceNotes": [
      "Data privacy regulations apply to lead data (GDPR, CCPA)",
      "Opt-out requests must propagate immediately"
    ],
    "aiReadiness": "High",
    "complexity": "Low",
    "typicalPainPoints": [
      "SDRs spend 40% of time on lead research that could be automated",
      "Lead routing rules are static and miss ideal routing paths",
      "Manual enrichment leads to inconsistent data quality",
      "Qualification criteria applied inconsistently across team"
    ],
    "estimatedEffort": "4-6 weeks for AI enrichment agent; 2-3 weeks for routing logic"
  },
  {
    "id": "BP-SALES-02",
    "name": "Intelligent Deal Forecasting",
    "department": "Sales",
    "description": "Process of collecting, updating, and analyzing pipeline data to produce accurate revenue forecasts.",
    "typicalTriggers": [
      "Weekly forecast review meeting",
      "End of quarter/month close",
      "Deal stage change notification"
    ],
    "steps": [
      {
        "stepOrder": 1,
        "name": "Deal Data Collection",
        "owner": "AE",
        "duration": "30 min",
        "dependsOn": [],
        "description": "AEs manually update deal stages, amounts, close dates in CRM",
        "aiOpportunity": "AI infers deal stage from email, meeting, and activity data"
      },
      {
        "stepOrder": 2,
        "name": "Deal Status Verification",
        "owner": "Sales Manager",
        "duration": "20 min",
        "dependsOn": [
          1
        ],
        "description": "Manager reviews deal updates for accuracy and flags risks",
        "aiOpportunity": "Automated risk flagging based on historical patterns"
      },
      {
        "stepOrder": 3,
        "name": "Pipeline Analysis",
        "owner": "Revenue Operations",
        "duration": "2 hours",
        "dependsOn": [
          2
        ],
        "description": "RevOps compiles pipeline reports, identifies trends, builds forecast models",
        "aiOpportunity": "AI generates forecast from CRM data with confidence intervals"
      },
      {
        "stepOrder": 4,
        "name": "Forecast Review",
        "owner": "VP Sales",
        "duration": "1 hour",
        "dependsOn": [
          3
        ],
        "description": "Executive review of pipeline, commit numbers, and risks",
        "aiOpportunity": "AI briefing with key risks, upsides, and recommended actions"
      },
      {
        "stepOrder": 5,
        "name": "Forecast Publishing",
        "owner": "Revenue Operations",
        "duration": "30 min",
        "dependsOn": [
          4
        ],
        "description": "Final forecast published to exec team and board reporting",
        "aiOpportunity": "Automated report generation with narrative context"
      }
    ],
    "kpis": [
      {
        "name": "Forecast Accuracy",
        "description": "Difference between forecast and actual revenue",
        "typicalBenchmark": "85%+ (best), <60% (needs improvement)"
      },
      {
        "name": "Pipeline Coverage Ratio",
        "description": "Pipeline value vs. revenue target",
        "typicalBenchmark": "3x-5x coverage"
      },
      {
        "name": "Forecast Update Cadence",
        "description": "How often forecasts are refreshed",
        "typicalBenchmark": "Weekly"
      }
    ],
    "systems": [
      {
        "name": "Salesforce",
        "category": "CRM",
        "typicalUsage": "Deal stage tracking and pipeline data"
      },
      {
        "name": "Clari",
        "category": "Analytics",
        "typicalUsage": "Forecasting and revenue intelligence"
      },
      {
        "name": "Gong",
        "category": "AI",
        "typicalUsage": "Deal risk signals from call analysis"
      }
    ],
    "complianceNotes": [
      "Revenue forecasts may be material information for public companies"
    ],
    "aiReadiness": "Medium",
    "complexity": "High",
    "typicalPainPoints": [
      "AEs spend hours each week manually updating deal data",
      "Forecast accuracy degrades as month-end approaches",
      "Deal risks detected too late to intervene",
      "Multiple spreadsheets with conflicting numbers"
    ],
    "estimatedEffort": "8-12 weeks for initial AI pipeline; ongoing model tuning"
  },
  {
    "id": "BP-SALES-03",
    "name": "Automated Sales Meeting Intelligence",
    "department": "Sales",
    "description": "Capturing, transcribing, analyzing, and extracting action items from sales calls and demos.",
    "typicalTriggers": [
      "Sales call or demo completed",
      "New prospect meeting scheduled",
      "Discovery call recording available"
    ],
    "steps": [
      {
        "stepOrder": 1,
        "name": "Call Recording",
        "owner": "AE/SDR",
        "duration": "Instant",
        "dependsOn": [],
        "description": "Sales call recorded via video conferencing platform",
        "aiOpportunity": "Auto-record and transcribe all calls"
      },
      {
        "stepOrder": 2,
        "name": "Note Taking",
        "owner": "AE/SDR",
        "duration": "10-20 min",
        "dependsOn": [
          1
        ],
        "description": "Rep manually takes notes during or after call",
        "aiOpportunity": "AI generates notes from transcript automatically"
      },
      {
        "stepOrder": 3,
        "name": "CRM Update",
        "owner": "AE/SDR",
        "duration": "10 min",
        "dependsOn": [
          2
        ],
        "description": "Rep updates CRM with call notes, next steps, and deal stage",
        "aiOpportunity": "AI auto-populates CRM fields from call content"
      },
      {
        "stepOrder": 4,
        "name": "Action Item Tracking",
        "owner": "AE/SDR",
        "duration": "5 min",
        "dependsOn": [
          3
        ],
        "description": "Track follow-up items, commitments, and deadlines",
        "aiOpportunity": "AI extracts and tracks action items with reminders"
      },
      {
        "stepOrder": 5,
        "name": "Deal Signal Analysis",
        "owner": "Sales Manager",
        "duration": "10 min",
        "dependsOn": [
          1
        ],
        "description": "Manager reviews call for coaching insights and deal signals",
        "aiOpportunity": "AI flags objection handling, competitive mentions, buying signals"
      }
    ],
    "kpis": [
      {
        "name": "Time Spent on Admin",
        "description": "Hours per week spent on call-related admin",
        "typicalBenchmark": "5-8 hours/week"
      },
      {
        "name": "CRM Data Completeness",
        "description": "Percentage of calls with complete CRM notes",
        "typicalBenchmark": "60-80%"
      },
      {
        "name": "Action Item Completion",
        "description": "Percentage of follow-ups completed on time",